stories,sadness,joy,fear,disgust,anger
"In ""The Echoes of Cedar Creek,"" Sarah Lawson returns to her hometown after a decade to bury her mother, grappling with grief and regret. As she reconnects with old friends, particularly Jake, she rediscovers her passion for painting and finds solace in her roots, ultimately choosing to embrace her past while forging a new future.",0.459237,0.50574,0.035457,0.006904,0.008814
"In *The Echo of Forgotten Dreams*, Ava Henderson escapes her chaotic life in Chicago, seeking solace in the quaint town of Willow Creek. There, she discovers a weathered journal that resonates with her own struggles. As she confronts her past through family turmoil, Ava finds healing and love with local carpenter Finn, ultimately choosing her own happiness.",0.488139,0.488094,0.045216,0.005665,0.027507
"In ""The Last Orchard,"" Emily Parsons grapples with the legacy of her father’s fading apple orchard as developers threaten its existence. Torn between preserving cherished memories for her son Ben and facing financial reality, she ultimately rallies the community to revive the orchard, embracing both her past and their hopeful future.",0.291951,0.424247,0.029486,0.014098,0.030123
"In ""The Echoes of Maplewood,"" Emily Carter returns to her hometown for her father’s memorial, confronting unresolved family tensions and rekindling connections. As she navigates grief and nostalgia, she bonds with her estranged brother and mother, ultimately helping to organize a fall festival that celebrates community and healing, honoring her father's legacy.",0.460446,0.317377,0.029044,0.009287,0.02671
"In ""The Grit Between Us,"" Rachel Hayes returns to her small hometown of Willow Springs after a decade, seeking solace from her chaotic city life. Reconnecting with her childhood friend Jake, she confronts past regrets and choices. As their bond deepens, Rachel discovers that facing her roots may lead to a hopeful future.",0.307058,0.361053,0.038929,0.0161,0.029876
"Clara Allen returns to Maplewood, inheriting her grandmother's old house and seeking a fresh start. As she uncovers the town's hidden history and the legacy of the Maplewood Circle, she encounters resistance from its former members. Driven to honor their stories, Clara creates an anthology that unites the community.",0.130196,0.59734,0.043877,0.030862,0.021664
"**Plot Summary: Beneath the Surface**  
After inheriting her late mother’s house in Cedar Grove, Maeve Sullivan seeks answers about her mother’s past. As she uncovers hidden letters and a mysterious artist named Thomas, Maeve discovers a complex family legacy. Amidst the town’s charm, she learns to embrace love, loss, and the truth of her identity.",0.216309,0.282964,0.201796,0.020681,0.018944
"In ""The Echoes of Maplewood,"" Claire Thompson reluctantly returns to her hometown for her estranged mother’s funeral after a decade away. Confronting painful memories, she reconnects with old friends and her father, ultimately seeking closure and redefining her future. Embracing her past, she discovers a renewed sense of hope.",0.419575,0.27967,0.033683,0.011452,0.03431
"In ""The Last Harvest,"" Maggie Thompson faces the impending foreclosure of her family's Nebraska farm, burdened by drought and despair. As she and her father work their last crop, a storm brings hope. Rallying the community, she ignites a fight for their legacy, proving that love and unity can withstand any challenge.",0.312906,0.253246,0.116026,0.010345,0.044801
"In *The Last Train Home*, Clara Ellis leaves her small-town life in Glenwood to chase her dreams in Chicago. Amidst the city's chaos, she finds solace in a bookstore and forges deep connections, especially with musician Jacob. As opportunities and uncertainties collide, Clara must embrace the unknown and her evolving identity.",0.361475,0.554344,0.073464,0.007798,0.020425
"In ""The Last Train Home,"" Amelia Hart escapes her small-town past, seeking a fresh start in New York City. Amidst the chaos, she discovers her passion for writing and confronts her father's mysterious disappearance. Through self-discovery and newfound connections, she learns that home is a journey within herself, not a destination.",0.137936,0.567639,0.083982,0.017488,0.165683
"In ""The Last Train to Pine Ridge,"" Nora Mae Jensen escapes her grief-stricken hometown, seeking renewal in the bustling city. There, she forms a deep bond with aspiring writer Ethan. As he pursues his dreams, Nora learns to embrace her past while forging a hopeful future, intertwining their paths through love and healing.",0.10418,0.65431,0.046033,0.017243,0.018282
"On his eighteenth birthday, restless Jesse Thompson leaves his hometown of Twin Pines, Kansas, seeking adventure in Copper Creek. There, he meets Clara, who introduces him to the town's hidden stories and vibrant community. As summer fades, Jesse discovers belonging and self-identity, realizing adventure resides both within and around him.",0.305804,0.505637,0.033185,0.007286,0.021123
"In ""The Shadows of Kane Valley,"" Clara Moore returns home after a decade to confront her past and the grief of losing her brother, Jake. Reconnecting with her mother and childhood friend Ethan, Clara begins to heal familial wounds and uncover long-buried secrets, ultimately discovering the strength to embrace love and forgiveness.",0.322581,0.278169,0.053317,0.01455,0.011543
"In ""The Last Train to Halcyon,"" Lucy Bennett returns to her grandmother's hometown after receiving a mysterious letter. As she uncovers family secrets through heartfelt letters and reconnects with the past, she finds purpose in storytelling, healing, and a sense of belonging, ultimately embracing her roots and community.",0.376301,0.552332,0.025126,0.012677,0.014743
"In ""The Sound of Distant Trains,"" Maggie Hale returns to her hometown, Cedar Grove, to settle her late grandmother's affairs but seeks escape from her corporate life. On a fateful train journey, she encounters Elise, a mysterious woman, leading to a transformative night at a music festival that rekindles her spirit.",0.490524,0.318695,0.052886,0.016304,0.013349
"In ""The Weight of Dust,"" Clara Monroe arrives in the small Texas town of Dusty Hollow seeking escape from her chaotic past. As she forms connections with the locals, particularly Jake and Daisy, she faces her memories and loneliness. Embracing community and confronting her pain, Clara begins her journey toward healing and hope.",0.309065,0.248018,0.108229,0.005992,0.019005
"In Cedar Grove, Clara Mason returns to a forgotten train station, clinging to hope of finding her missing brother, Tommy. As she uncovers painful memories and a connection to the local drifter, Jake, Clara confronts her past. Ultimately, she finds closure and the strength to move forward.",0.547552,0.282017,0.06152,0.007221,0.148008
"In ""The Distance Between Us,"" sixteen-year-old Lila Hayes reluctantly returns to her mother's hometown of Maplewood, feeling like an outsider. However, as summer unfolds, she forges unexpected friendships, discovers her passion for art, and begins to embrace small-town life. Ultimately, Lila must choose between her past in Chicago and a hopeful future in Maplewood.",0.277307,0.591793,0.032476,0.014319,0.00889
"In ""The Echoes of Maplewood,"" Amelia Hart returns to her hometown after a decade, grappling with the loss of her grandmother and confronting her bittersweet memories. As she reconnects with old friends, particularly Jacob, she contemplates her future, discovering that home holds the promise of healing and belonging.",0.487199,0.321947,0.037711,0.005549,0.007182
"In ""The Last Light of Sunset Grove,"" Jack Whitaker returns to his hometown after fifteen years, burdened by regret and memories. Confronting estranged family and friends, he seeks redemption and healing. With the support of his first love, Maggie, Jack embarks on a journey to mend broken bonds and find hope.",0.476318,0.438269,0.036546,0.005725,0.006529
"Rachel Monroe returns to her hometown, Silver Oak, after a decade of chasing dreams in New York, only to find her relationships strained and unfulfilled ambitions haunting her. Reconnecting with her sister Lily and confronting the ghosts of her past, Rachel discovers the power of belonging, love, and new possibilities.",0.258904,0.261303,0.081849,0.004883,0.015077
"In ""The Last Train Home,"" Clara Jensen boards a train from Maplewood to Chicago, seeking adventure and self-discovery. Onboard, she meets Jake, a kindred spirit escaping his past. Together, they explore the city, sharing dreams and fears, as Clara learns that belonging and independence can coexist on her journey to find herself.",0.269166,0.546348,0.088582,0.006198,0.013612
"In ""The Last Train to Cedar Hollow,"" Hannah Ellis leaves her stagnant hometown for the vibrant life of Chicago, seeking new dreams and experiences. Amidst the city's chaos, she meets Leo, who inspires her to embrace adventure. Ultimately, she returns home transformed, ready to revive her community and chase new stories.",0.13406,0.585533,0.030233,0.004815,0.043037
"In ""The Last Train Home,"" Clara Mitchell returns to her childhood town of Elmwood after receiving alarming news about her father's health. Confronting buried family secrets and unresolved emotions, she reconnects with her past and finds healing. As she embraces her roots, Clara discovers a path to reclaiming her life and future.",0.310069,0.386791,0.04786,0.019529,0.033318
"In ""The Last Train to Pinewood,"" Evelyn Hart boards a departing train, leaving behind her haunted past in a rain-soaked town. As she journeys to Seattle, she forms a connection with Alex, a musician chasing dreams. Together, they navigate grief, hope, and the promise of new beginnings, embracing life's uncertainties.",0.277568,0.491863,0.135123,0.046209,0.020118
"In ""The Last Call,"" Jamie, a struggling writer, waits in a diner for a life-changing phone call. As rain falls, he shares hopes with Sarah, a friend also seeking opportunity. When the call comes, a publisher wants his manuscript. Together, they embrace new beginnings, rekindling dreams and friendship in Maplewood.",0.166462,0.48071,0.054242,0.013168,0.061191
"**Plot Summary:** Jordan Ellis returns to Cedar Hollow after a decade, confronting nostalgia and the struggles of his hometown. Reconnecting with old friends, he learns of whispers in the woods and the spirits tied to the land. Inspired, he helps organize a festival, uniting the community and embracing their shared history.",0.258489,0.609005,0.02825,0.009519,0.01187
"In ""The Weight of the Sky,"" Emma Malone grapples with grief after her father's death while seeking a fresh start in New York City. Joined by her childhood friend Noah, Emma navigates the city's vibrancy and discovers her passion for writing. Together, they embrace change, transforming pain into hope and new beginnings.",0.19154,0.676015,0.040498,0.006342,0.017892
"In ""The Last Train to Nowhere,"" mechanic Sam Hargrove embarks on a journey to New Orleans after receiving distressing news about his estranged father’s hospitalization. On the train, he meets Lily, who shares her own family struggles. Confrontation and healing unfold as Sam seeks to reconcile with his father's addiction, igniting hope for redemption and connection.",0.389986,0.394477,0.054272,0.025638,0.042554
"In the quiet town of Maplewood, Sarah Thompson returns after her father's death, only to uncover unsettling secrets tied to her past. As she investigates mysterious disappearances linked to her father, she confronts haunting truths that challenge her understanding of family and home, ultimately leading to healing and renewal for the community.",0.413726,0.135777,0.350813,0.006691,0.014877
"In ""Shadows of the Heartland,"" Eliza Harper returns to her hometown of Waverly after receiving a letter from her late grandmother, Mae. Discovering Mae's past romance with Thomas McAllister, Eliza forms an unexpected bond with him. Together, they uncover Mae’s untold story, healing old wounds and embracing their shared legacy.",0.316365,0.497461,0.054736,0.014129,0.015921
"In ""The Last Train Home,"" Clara Mitchell escapes her stifling life in Pine Hollow following her mother’s death. Boarding a train to Chicago, she seeks a fresh start with her cousin, Emily. Facing job rejections, Clara perseveres, ultimately landing her dream job in publishing and discovering her true self amidst the city's vibrant energy.",0.236235,0.472494,0.033716,0.017468,0.104186
"In ""The Sound of Rain,"" Sarah Thompson arrives in the small town of Maplewood seeking refuge from her troubled past. As she explores the quaint landscape, she forms a deep connection with artist Ethan. Together, they confront their heartaches, finding solace and hope in each other amidst the autumn rains.",0.119397,0.737665,0.092313,0.024189,0.031513
"In ""The Fading Echo,"" Lauren Redmond returns to her hometown of Oak Hollow after her mother's death, confronting memories and the town’s decline. Reconnecting with old friends, especially Jacob, ignites her desire to revive the community. As they work together, Lauren faces a choice between her past and future, discovering hope anew.",0.416843,0.430729,0.039926,0.010327,0.014665
"In ""The Last Train Home,"" Jack McAllister, a mechanic from the sleepy town of Maple Grove, embarks on an impulsive journey to Chicago, seeking adventure and escape from his mundane life. Along the way, he meets Mia, an aspiring artist, who helps him rediscover himself and embrace new possibilities.",0.220575,0.671049,0.042775,0.003654,0.013108
"In ""The Weight of Stars,"" Claire Reynolds arrives in the small town of Welby, seeking a fresh start after leaving her troubled past behind. As she immerses herself in the town's community and befriends astronomer Elliot, she confronts her memories and learns to embrace hope, love, and her own identity beneath the vast night sky.",0.15337,0.625967,0.056122,0.005629,0.01508
"Mira Thompson faces her mother's death by tackling a scavenger hunt of unfinished tasks, starting with cleaning the attic. Discovering a locked trunk, she seeks help from neighbor Jake. Together, they uncover letters and memories that guide Mira toward healing, connection, and acceptance of her past, igniting hope for her future.",0.271537,0.213798,0.108027,0.026061,0.058862
"In *Between Two Rivers*, Lucy Caldwell returns to her hometown after her father's death, aiming to support her grieving mother. A fishing trip rekindles shared memories, illuminating their path to healing. As they navigate grief together, Lucy and her mother begin creating new memories, discovering hope amidst their sorrow.",0.560228,0.277356,0.027286,0.010221,0.011536
"In *A Thread of Silver*, Clara Bennett returns to her hometown of Silver Creek after her mother's death, confronting unresolved family pain. As she reconnects with old friends and unravels her mother’s past through a journal, Clara seeks healing and forgiveness, ultimately finding hope and a sense of belonging in her roots.",0.536704,0.244884,0.027652,0.006681,0.017819
"In ""The View From Cider Hill,"" Emma Kinsley struggles with grief after her mother’s passing while managing her family’s orchard. When photographer Jake arrives, their connection blossoms, inspiring Emma to expand the farm into a cider business. Together, they navigate love, legacy, and healing amidst the beauty of autumn.",0.234864,0.658918,0.047429,0.007121,0.010577
"In the winter of 1985, sixteen-year-old Ellie Harper escapes her small-town life in Crestwood by hopping on a freight train, seeking adventure and self-discovery. Along her journey, she meets strangers who share their stories, ultimately realizing her true adventure lies in embracing her roots and forging her own path.",0.181953,0.445923,0.026421,0.010025,0.029911
"**Plot Summary:** In ""The Last Train to Nowhere,"" Maggie Hayes escapes her suffocating small-town life aboard the Old Iron train, seeking adventure and self-discovery. Alongside the wise Agnes, she navigates unexpected challenges and deep conversations. Upon reaching Denver, Maggie embraces her new beginning, ready to write her own story.",0.12053,0.779317,0.077318,0.009968,0.02166
"In ""The Last Train Home,"" Emma Reynolds embarks on a transformative journey from her small town to New York City, chasing her dream of becoming a writer. Along the way, she navigates challenges, forges meaningful connections, and discovers her voice, ultimately embracing the unknown and the possibilities ahead in her new life.",0.10783,0.89636,0.067849,0.00574,0.020702
"In **The Grove**, recent art graduate Lily Thompson arrives in the quaint town of Jasper, seeking inspiration. Drawn to the mystical forest and an abandoned cabin, she discovers a vibrant artistic community led by the charismatic Caleb. As she paints, Lily finds herself, connection, and a future filled with endless possibilities.",0.047341,0.745491,0.052868,0.007987,0.035682
"In ""The Last Train to Everglade,"" sixteen-year-old Ben Miller grapples with the monotony of small-town life. When he discovers Amtrak's summer adventure, he faces a pivotal choice: escape to Tampa with his best friend Jake or remain in Everglade. The journey tests their friendship and ignites Ben's desire for freedom.",0.272803,0.443279,0.02755,0.045012,0.100839
"In ""The Weight of Shadows,"" Frank Morgan returns to his childhood town of Haverford, Oklahoma, after a decade to visit his dying mother. Confronting memories and unresolved pasts, Frank and his sister Lily find strength in their shared love as they grapple with loss and the weight of family ties, vowing to honor her legacy.",0.677347,0.177293,0.029553,0.010318,0.008355
"In ""The Weight of the Fabric,"" Anna Ramirez toils in a sewing factory while dreaming of launching her own fashion line. With the help of mentor Lila, she transforms her designs into vibrant expressions of her identity. Facing doubts and pressures, Anna ultimately finds success, inspiring her community to pursue their dreams.",0.099624,0.519262,0.047139,0.01664,0.013694
"In ""Echoes of the Valley,"" Ivy returns to her hometown after her mother’s death, unearthing hidden letters from a past love, Daniel. As she navigates grief and nostalgia, Ivy discovers her mother’s complexities and sacrifices. Amidst revelations, Ivy finds healing, rekindles friendships, and creates a new beginning in Maplewood.",0.307327,0.280818,0.043781,0.008243,0.013222
"In “The Weight of Stars,” Clara Harper escapes her chaotic life in Chicago, seeking solace in the small town of Evermore, Kansas. There, she forms a deep connection with local musician Jake, exploring both joy and sorrow. As the festival ends, Clara must choose between returning home or embracing her newfound sanctuary.",0.125336,0.784121,0.03799,0.005208,0.014111
"In ""The Last Train to Evergreen,"" Jenna Thompson embarks on a transformative journey from her small hometown to bustling Chicago, seeking to escape her past and rediscover herself. Accompanied by her supportive friend Marcus, she navigates new experiences, confronts her grief, and ultimately learns to embrace life, finding hope and belonging.",0.136622,0.474642,0.021191,0.005529,0.018992
"In *Echoes of the Past*, Nora Ellis returns to her hometown of Maplewood to confront her family’s painful history after inheriting her childhood home. As she unearths secrets about her mother’s past and her father’s disappearance, Nora reconnects with old friends, particularly Jake, and begins to heal, forging a new path forward.",0.461455,0.264648,0.048303,0.00847,0.015336
"In ""The Last Stop,"" Rachel Monroe boards a train at Lonesome Pines Station, seeking escape from her mundane life in Chicago. Onboard, she meets Bill, a fellow traveler who inspires her to confront her fears and regrets. As unexpected stops unfold, Rachel discovers the power of choice, embracing her journey toward self-discovery.",0.37747,0.320326,0.140317,0.014498,0.019795
"In Maplewood, 15-year-old Ellie Thompson discovers Old Man Parker's Christmas wish: to see the town's lights one last time. Igniting his forgotten spirit, she ventures out with him, forging a heartfelt friendship. After a magical evening, Parker peacefully passes away, leaving Ellie inspired to honor his legacy through storytelling.",0.307866,0.499081,0.043677,0.022508,0.015838
"In the summer of 1999 in Ashwood, Kentucky, Clara Bennett grapples with grief after her mother’s death, feeling the weight of change as her brother, Ben, leaves for college. Together, they confront their shared sorrow and rediscover hope through memories, family bonds, and the promise of new beginnings amidst loss.",0.556097,0.355867,0.022972,0.003448,0.009456
"In **Echoes of the Forgotten**, Anna Collins returns to her ancestral town of Maplewood, seeking connection to her family's past. Exploring the dilapidated Collins house, she uncovers letters revealing her grandmother's struggles and love. Embracing her heritage, Anna finds solace and belonging, transforming the town's haunting echoes into a legacy of resilience.",0.295882,0.273744,0.096047,0.010606,0.013765
"In ""The Weight of Ashes,"" Jack Kincaid returns to Millstone after a decade, grappling with grief over his mother's death. Discovering letters from a mysterious man named Thomas, he confronts their shared past. As Jack unearths painful truths and reconnects with Thomas, he learns to embrace love, loss, and healing.",0.626443,0.172323,0.049397,0.018942,0.017019
"In ""The Last Train to Fenton,"" Beatrice “Bea” Harper arrives in the nostalgic town of Fenton seeking solace and a connection to her grandmother's past. As she explores the community and bonds with local resident Ethan, Bea uncovers her heritage and rekindles her lost dreams, ultimately finding a renewed sense of purpose.",0.168244,0.688026,0.036968,0.014506,0.00821
"In ""The Echoes of Maplewood,"" Claire returns to her nostalgic hometown for the Fall Festival after a decade away. Reconnecting with old friends, particularly Tom, she grapples with her past and the choices that led her away. Ultimately, Claire embraces the warmth of Maplewood, deciding to stay and rediscover herself.",0.294373,0.745595,0.012348,0.007875,0.021003
"In ""The Broken Compass,"" Jane Miller returns to her hometown of Hartsville after a decade away, seeking to confront her painful past and reconnect with her estranged mother. As they navigate their shared grief over her father's departure, they rebuild their bond. Together, they embrace healing and new beginnings, discovering the strength of home.",0.565937,0.35083,0.045197,0.010622,0.014434
"In ""The Sound of Falling Leaves,"" Oliver Hart returns to his hometown of Crestwood after five years, grappling with nostalgia and the weight of his mother’s illness. Rediscovering his passion for writing and reconnecting with old friends, he learns that home is not just a place, but a journey of self-discovery.",0.415186,0.537376,0.037433,0.008396,0.00908
"In ""The Last Train to Nowhere,"" Nina Miller boards a train from her stagnant life in Millfield, Ohio, to pursue dreams in Denver. Along the way, she forms unexpected connections, confronts her fears, and discovers her true self. The journey transforms her, leading to newfound freedom and inspiration.",0.14495,0.603936,0.163497,0.012153,0.010721
"In Cedar Hollow, dreamer Amelia Hart finds solace in stargazing. With best friend Jake, she navigates the challenges of young adulthood, exploring their dreams amidst the pressures of reality. As they face new beginnings and uncertainties, the stars remind them of their bond, guiding their paths toward hopeful futures.",0.134681,0.76922,0.063287,0.009898,0.015768
"Elena returns to her childhood home, Maplewood, after a decade away, reuniting with her brother Tommy. As they confront their shared past, including their parents’ secrets revealed through letters, they grapple with grief and healing. Together, they restore the house, transforming it into a sanctuary of memories and new beginnings.",0.457693,0.503683,0.048201,0.007552,0.01059
"In the quaint town of Ashwood, Maggie, a café barista, grapples with her past until Ethan, a newcomer seeking inspiration, sparks her interest. Together, they embark on a collaborative writing project, rekindling Maggie's dreams. As autumn fades, she discovers hope, love, and the promise of new beginnings in their shared journey.",0.173932,0.869035,0.055111,0.009891,0.005961
"In ""The Last Train to Cedar Springs,"" Emma Jensen leaves her small-town life behind, boarding the final train to pursue her dreams in Chicago. Along the way, she meets musician Jake, who inspires her to embrace adventure and possibility. As she arrives in the vibrant city, Emma’s journey of self-discovery truly begins.",0.096469,0.829026,0.044126,0.006299,0.062402
"In ""The Weight of Silence,"" Nora Sullivan returns to her hometown of Oakwood after her father's death, grappling with memories and estrangement. As she reconnects with her past and childhood friend Ethan, she uncovers family secrets and begins healing. Ultimately, she learns to embrace her roots and find her voice.",0.352873,0.605688,0.042667,0.010612,0.01148
"In Harlow, Kansas, sixteen-year-old Clara Bennett dreams of the stars, yearning for adventure beyond her struggling family farm. When a drifter named Jonah arrives, he inspires her to pursue her passion for astrophysics. Torn between loyalty and ambition, Clara ultimately decides to chase her dreams, carrying home in her heart.",0.195739,0.511436,0.046346,0.005641,0.010698
