stories,sadness,joy,fear,disgust,anger
"In Cedar Grove, Maggie Carter returns to her hometown, grappling with lost dreams of becoming an artist. Encouraged by friends, she unveils her painting at a town meeting, igniting a community project to transform an old mill into an art space. As creativity blossoms, so does her connection with childhood friend Ryan.",0.267122,0.764204,0.079234,0.007739,0.008929
"In ""The Last Train to Harrow,"" Max Bennett boards the final train from his stagnant hometown, seeking adventure and a new life in Chicago. Amidst excitement and anxiety, he discovers the vibrant city, confronts his fears, and embraces his passion for acting, ultimately forging a path toward self-discovery and fulfillment.",0.186701,0.465958,0.110329,0.004914,0.016843
"In ""The Weight of Stars,"" Clara Jensen grapples with the decision to leave her small town for an internship in New York City. Encouraged by her best friend Sophie and her former teacher, she takes a leap of faith, navigating self-doubt and challenges, ultimately discovering her potential and finding her place in the world.",0.076568,0.59501,0.037117,0.033062,0.021817
"Evelyn Hayes returns to her hometown of Maplewood after a decade, armed with a novel that stirs up old memories and tensions. As she confronts her past and the town's resistance to her truth, Evelyn discovers the power of storytelling, ultimately fostering connection and healing within her community.",0.400248,0.352034,0.052069,0.006425,0.009812
"In ""The Last Echoes of Pinewood,"" Clara returns to her hometown after her mother’s mysterious death. As she confronts old memories, she uncovers dark secrets tied to her mother’s past. With friends Jake and Molly, she dares to challenge a powerful circle, seeking truth and justice in a town haunted by whispers.",0.394294,0.147377,0.074632,0.017352,0.049511
"In ""The Last Train to Nowhere,"" Clara boards a train in Winslow, Arizona, seeking escape from her grief over her late husband. During an unexpected delay, she meets Mark, sparking a connection that reignites her spirit. As they share stories, Clara realizes it's time to embrace new beginnings and possibilities.",0.324881,0.433794,0.06762,0.006781,0.023871
"In ""The Quiet Corners of Hope,"" Rose Thompson leaves her small-town life in Maplewood for Chicago, seeking self-discovery. Amid the city's chaos, she meets Liam, an artist grappling with his own fears. As they bond, both realize they must confront their pasts. Ultimately, Rose returns home, transformed and hopeful.",0.355741,0.258401,0.131848,0.014323,0.030273
"Clara Thompson boards the last train home after a decade of feeling trapped in her small-town life. Journeying to Chicago, she encounters George, an elderly man who inspires her to embrace her dreams. With newfound courage and the friendship of Mia, Clara reignites her passion for writing, transforming her future.",0.274697,0.646523,0.04706,0.012212,0.009488
"Clara Thompson returns to Cedar Springs for her mother’s funeral after years of chasing dreams in Nashville. Confronting bittersweet memories, she finds solace in an encounter with Agnes, a kind stranger. Reconnecting with her past inspires Clara to reclaim her love for music, igniting hope for a new future.",0.307253,0.590084,0.072374,0.014457,0.007472
"In ""The Last Train Home,"" Clara Thompson escapes her mundane life in Maplewood by taking a spontaneous trip to Chicago. On the train, she meets John, whose warmth inspires her to embrace adventure. As they explore the vibrant city together, Clara discovers a newfound sense of freedom, friendship, and hope for the future.",0.187678,0.756309,0.039411,0.008254,0.032064
"In the midst of the Great Depression, Clara McKinney arrives in the desolate town of Dawson, Oklahoma, to join her brother Sam. As they face drought and dust storms, Clara discovers resilience and community. With the support of Jake, a newfound friend, she embraces leadership and hope, igniting love amidst adversity.",0.312994,0.494545,0.077518,0.004101,0.013593
"In ""The Echoes of Cedar Creek,"" Maggie Harper returns to her childhood town to seek closure after her mother's death. Amidst familiar sights and old friends, she confronts grief, reconnects with memories, and learns that healing comes from embracing the past. Ultimately, she discovers home is within her heart.",0.418669,0.277368,0.042004,0.00891,0.012762
"In Willow Creek, Kansas, recent college grad Lily Thompson seeks tranquility away from Chicago's chaos. Embracing her new life, she forms bonds with locals, including the charming Jake. When a storm uproots the beloved cottonwood tree, the community unites in grief, leading Lily to discover love and belonging in her new home.",0.260442,0.527009,0.040531,0.003842,0.049232
"In ""The Last Train Home,"" Clara returns to her childhood town to care for her ailing mother, navigating memories and unresolved feelings. Faced with the choice between her old life in Chicago and her family's needs, Clara discovers the strength of love and the importance of following one's heart, ultimately embracing new beginnings.",0.418283,0.549189,0.021563,0.005377,0.005608
"In *The Last Train Home*, Clara Thompson leaves her small town for Chicago, seeking adventure and a writing career. On her journey, she meets Jake, an aspiring musician, and they connect deeply over shared dreams. As Clara embraces her new life, their bond evolves, igniting hope for a bright future together.",0.112445,0.733992,0.039031,0.004784,0.014907
"After a decade away, Anna Rhodes returns to Willow Creek to settle her late mother's estate. Uncovering hidden letters reveals a love affair with Jacob, a tragic figure from her mother’s past. Confronting these secrets, Anna gains clarity, allowing her to embrace a future free from haunting memories.",0.329385,0.297357,0.0866,0.009453,0.025193
"Emily Carter returns to the forgotten town of Pine Ridge after receiving a letter from her ailing grandmother. There, she uncovers her father's journal, revealing family secrets and the struggles he faced. As Emily confronts her past, she learns to forgive, reconnecting with her roots and embracing new beginnings.",0.577802,0.271428,0.074629,0.013109,0.019286
"**Plot Summary:** Sarah Mitchell returns to her hometown after years in the city, seeking simplicity and connection. Reuniting with her first love, Jake, she confronts her dreams and past choices. As they rekindle their relationship, Sarah faces a pivotal decision: stay and embrace a new life or return to her bustling city life. Ultimately, she chooses love and belonging, realizing home is not just a place but a feeling.",0.204221,0.706573,0.018323,0.006413,0.017538
"Eleanor Hart boards the last train to Chicago in 1952, seeking a fresh start and leaving behind her worried younger brother, Tommy. As she embraces her new life, she navigates challenges, forges meaningful connections, and ultimately returns home, blending her past and present to inspire others through storytelling and mentorship.",0.132873,0.566381,0.105876,0.003393,0.017089
"Clara returns to Cedar Ridge after a decade, drawn back by nostalgia and unresolved feelings. Meeting Daniel, her first love, they confront the changes in their town and lives. As memories resurface, their connection deepens, leading Clara to embrace her past and consider a future together, finding solace in shared experiences.",0.307855,0.652788,0.053136,0.008094,0.006026
"In ""The Last Train Home,"" Maeve Donovan boards a train from her fading hometown of Mitchell, West Virginia, seeking escape and a new life in Charleston. There, she meets Jake, a kindred spirit with dreams of music. Together, they embark on a journey of self-discovery, leaving their pasts behind.",0.374573,0.349776,0.20275,0.010645,0.018518
"In ""The Last Train Home,"" Eliza Greene leaves her small-town life in Millstone, New Jersey, to pursue an internship in New York City. As her mother's illness deepens, Eliza grapples with her ambitions and family ties, ultimately choosing to return home, discovering resilience and new purpose in caring for her mother.",0.293059,0.450909,0.036201,0.029651,0.011542
"In ""The Last Train Home,"" Marissa Carter journeys to Cedar Springs after her father's death, seeking her family's roots. Upon discovering her childhood home, she uncovers hidden letters revealing a complicated love story. With the help of a local, Sam, they embark on a quest to unveil her father's past, finding healing and connection.",0.324309,0.519327,0.055911,0.013027,0.01333
"In ""The Last Bus to Evergreen,"" eighteen-year-old Cassie Miller leaves her small town for New York City, seeking adventure and freedom. On her journey, she grapples with doubts and familial concerns, but upon arrival, she discovers a vibrant world of possibilities. With newfound friends, she embraces her dreams, ready to forge her own path.",0.28983,0.560037,0.072357,0.00773,0.021464
"**Plot Summary:**

After years of isolation in a Maine lighthouse following his wife's death, Elijah Harper's life changes when a storm-stranded woman named Clara arrives seeking shelter. Their connection rekindles Elijah's lost joy, but Clara must leave for family. When she returns, they embrace a shared future, finding hope together.",0.305894,0.427403,0.163683,0.00921,0.016104
"Alice Monroe returns to Maplewood after her grandmother's passing, seeking a fresh start. Amidst the rustic charm, she hears whispers from the pines linked to her grandmother’s childhood friend, Thomas, who vanished years ago. As Alice unravels the town's secrets, she helps heal old wounds and finds her place in the community.",0.294057,0.379387,0.042183,0.007773,0.011631
"In Montgomery, Alabama, Jesse Miller’s struggling print shop transforms when old friend Clara returns, sparking a revival of creativity and community. Together, they host a successful art exhibit, leading to street fairs that breathe life back into the town. Jesse discovers purpose, hope, and the power of connection through art.",0.269384,0.56693,0.035,0.011442,0.017221
"In ""The Echoes of Maplewood,"" Claire Bennett returns to her hometown after a decade in New York City, seeking her lost identity. Reuniting with childhood friend Lucy, they explore the mysterious Wilson estate, uncovering secrets of the past. Claire's journey leads her to help the spirit of Evelyn Wilson find peace, ultimately redefining her connection to home and self.",0.321498,0.484412,0.043861,0.00629,0.033002
"In ""Dust and Echoes,"" Amelia Harper returns to her hometown of Riverton after a decade, haunted by memories and unresolved friendships. As she reconnects with her past, especially her estranged friend Lucy, she finds solace and belonging through community and shared experiences. Ultimately, Amelia discovers that returning home leads to healing and new beginnings.",0.451588,0.40789,0.092247,0.00929,0.017271
"In ""The Last Train Home,"" Clara Thompson returns to her childhood town of Prescott to reconcile with her estranged father, Harold, after years of emotional distance. As they confront past grief and misunderstandings, they rebuild their bond, learning to cherish memories of her late mother, and embrace a hopeful future.",0.614877,0.198324,0.034479,0.004814,0.017646
"In ""The Last Train to Hope,"" Clara Hughes leaves her stagnant life in Pine Ridge, seeking adventure and self-discovery in the city. Joined by new friend Maya on the journey, they share dreams and aspirations, igniting Clara's hope. Embracing the unknown, Clara finds freedom, purpose, and the promise of a vibrant future.",0.153172,0.767985,0.047105,0.008291,0.027825
"In Maplewood, Jane Reynolds, a passionate science teacher, battles self-doubt as she pitches a community garden project to a skeptical school board. Rallying local support, she faces challenges and resistance but ultimately unites the town. The garden flourishes, symbolizing resilience, community spirit, and the transformative power of collaboration.",0.09146,0.787266,0.045079,0.013563,0.032048
Averages,0.3,0.49,0.06,0.01,0.02
